<?xml version="1.0"?>
<!DOCTYPE Root SYSTEM "./config.dtd">
<root>  
    <section>INITIAL_REQUEST_COOKIES
        <tag>REDIRECT_COOKIE_KEY
            <value>REDIRECT_COOKIE</value>
        </tag>
    </section>  
    
    <section>OTHER_REQUEST_COOKIES
        <tag>IBSESSION_COOKIE_KEY
            <value>IBSESSION_COOKIE</value>
        </tag>
        <tag>LOGOFF_COOKIE_KEY
            <value>LOGOFF_COOKIE</value>
        </tag>
        <tag>LTPATOKEN_COOKIE_KEY
            <value>LTPATOKEN_COOKIE</value>
        </tag>
        <tag>JSESSIONID_COOKIE_KEY
            <value>JSESSIONID_COOKIE</value>
        </tag>
    </section>  
    
    <section>REDIRECT_COOKIE
        <tag>NAME
            <value>redirect</value>
        </tag>
        <tag>VALUE
            <value>[0-9a-zA-Z+?.,%*:;"(){} /-]*</value>
        </tag>
        <tag>DOMAIN
            <value>.lloydstsb.co.uk</value>
        </tag>
        <tag>PATH
            <value>/</value>
        </tag>
        <tag>SECURE
            <value>true</value>
        </tag>
    </section>  

    <section>IBSESSION_COOKIE
        <tag>NAME
            <value>IBSESSION</value>
        </tag>
        <tag>VALUE
            <value>[0-9a-zA-Z+?.,%*:;"(){} /-]*</value>
        </tag>
        <tag>DOMAIN
            <value>.lloydstsb.co.uk</value>
        </tag>
        <tag>PATH
            <value>/</value>
        </tag>
        <tag>SECURE
            <value>true</value>
        </tag>
    </section>  

    <section>LOGOFF_COOKIE
        <tag>NAME
            <value>logoff</value>
        </tag>
        <tag>VALUE
            <value>[0-9a-zA-Z+?.,%*:;"(){} /-]*</value>
        </tag>
        <tag>DOMAIN
            <value>.lloydstsb.co.uk</value>
        </tag>
        <tag>PATH
            <value>/</value>
        </tag>
        <tag>SECURE
            <value>true</value>
        </tag>
    </section>  

    <section>LTPATOKEN_COOKIE
        <tag>NAME
            <value>LtpaToken2</value>
        </tag>
        <tag>VALUE
            <value>[0-9a-zA-Z+?.,%*:;"(){} /-]*</value>
        </tag>
        <tag>DOMAIN
            <value>.lloydstsb.co.uk</value>
        </tag>
        <tag>PATH
            <value>/</value>
        </tag>
        <tag>SECURE
            <value>true</value>
        </tag>
    </section>  

    <section>JSESSIONID_COOKIE
        <tag>NAME
            <value>JSESSIONID</value>
        </tag>
        <tag>VALUE
            <value>[0-9a-zA-Z+?.,%*:;"(){} /-]*</value>
        </tag>
        <tag>DOMAIN
            <value>.lloydstsb.co.uk</value>
        </tag>
        <tag>PATH
            <value>/</value>
        </tag>
        <tag>SECURE
            <value>true</value>
        </tag>
    </section>

    <section>
        EXPECTED_COOKIES
        <tag>
            REDIRECT_COOKIE
            <value>redirect</value>
        </tag>
        <tag>
            IBSESSION_COOKIE
            <value>IBSESSION</value>
        </tag>
        <tag>
            LOGOFF_COOKIE
            <value>logoff</value>
        </tag>
        <tag>
            LTPATOKEN_COOKIE
            <value>LtpaToken2</value>
        </tag>
        <tag>
            JSESSIONID_COOKIE
            <value>JSESSIONID</value>
        </tag>
        <tag>
            THROTTLE_COOKIE
            <value>&THROTTLE_COOKIES_NAME;</value>
        </tag>
        <tag>
            INDRA_COOKIE
            <value>pp</value>
        </tag>
        <tag>
            PHISHING_COOKIE
            <value>IBCOOKIE02</value>
        </tag>
        <tag>
            dcConnector_COOKIE
            <value>dcConnector</value>
        </tag>
        <tag>
            WT_FPC_COOKIE
            <value>WT_FPC</value>
        </tag>
        <tag>
            ShortTimeoutInterval_COOKIE
            <value>ShortTimeoutInterval</value>
        </tag>
        <tag>
            IBCcookieID_COOKIE
            <value>IBCcookieID</value>
        </tag>
        <tag>
            IBCBrandContext_COOKIE
            <value>IBCBrandContext</value>
        </tag>
        <tag>
            IBCUserID_COOKIE
            <value>IBCUserID</value>
        </tag>
        <tag>
            E_PRIVACY_COOKIE
            <value>IBCOOKIE03</value>
        </tag>
        <tag>
            MORTGAGE_COOKIE_COLLEAGUE_ID
            <value>IBMortgageColleagueID</value>
        </tag>
    </section>
</root>