<?xml version="1.0"?>
<!DOCTYPE Root SYSTEM "./config.dtd">
<root>
	<section>
		A10001
		<tag>
			EVENT_NAME
			<value>configuration.parse</value>
		</tag>
		<tag>
			ENABLED
			<value>1</value>
		</tag>
	</section>
	<section>
		A10002
		<tag>
			EVENT_NAME
			<value>state.refdata</value>
		</tag>
		<tag>
			ENABLED
			<value>1</value>
		</tag>
	</section>
	<section>
		A10003
		<tag>
			EVENT_NAME
			<value>configfile.loaded</value>
		</tag>
		<tag>
			ENABLED
			<value>1</value>
		</tag>
	</section>
	<section>
		A10004
		<tag>
			EVENT_NAME
			<value>prefetchworker.startwork</value>
		</tag>
		<tag>
			ENABLED
			<value>1</value>
		</tag>
	</section>
	<section>
		A10005
		<tag>
			EVENT_NAME
			<value>navrules.loaded</value>
		</tag>
		<tag>
			ENABLED
			<value>1</value>
		</tag>
	</section>
	<section>
		A10006
		<tag>
			EVENT_NAME
			<value>bookmarkrules.loaded</value>
		</tag>
		<tag>
			ENABLED
			<value>1</value>
		</tag>
	</section>
	<section>
		A10007
		<tag>
			EVENT_NAME
			<value>ajaxrules.loaded</value>
		</tag>
		<tag>
			ENABLED
			<value>1</value>
		</tag>
	</section>
	<section>
		A10008
		<tag>
			EVENT_NAME
			<value>servicetype.set</value>
		</tag>
		<tag>
			ENABLED
			<value>1</value>
		</tag>
	</section>
	<section>
		A10009
		<tag>
			EVENT_NAME
			<value>channelvalue.set</value>
		</tag>
		<tag>
			ENABLED
			<value>1</value>
		</tag>
	</section>
	<section>
		A10010
		<tag>
			EVENT_NAME
			<value>brandvalue.set</value>
		</tag>
		<tag>
			ENABLED
			<value>1</value>
		</tag>
	</section>
	<section>
		A10011
		<tag>
			EVENT_NAME
			<value>content.notfound</value>
		</tag>
		<tag>
			ENABLED
			<value>1</value>
		</tag>
	</section>
	<section>
		A10012
		<tag>
			EVENT_NAME
			<value>devicecapability.activitylog</value>
		</tag>
		<tag>
			ENABLED
			<value>1</value>
		</tag>
	</section>
	<section>
		MF0001
		<tag>
			EVENT_NAME
			<value>ManagementFramework.logLevelChanged</value>
		</tag>
		<tag>
			ENABLED
			<value>1</value>
		</tag>
	</section>
	<section>
		A10013
		<tag>
			EVENT_NAME
			<value>syncToken.doubleSubmitDetected</value>
		</tag>
		<tag>
			ENABLED
			<value>1</value>
		</tag>
	</section>

</root>