<?xml version="1.0"?>
<!DOCTYPE root SYSTEM "./config.dtd">
<root>
      <section>
            API_SERVICE_ENDPOINTS
            <tag>
                  ADDRESS_SEARCH
                  <value>http://apptuvirtual054.machine.test.group:12305/aft/InformationProvisionService</value>
            </tag>
            <tag>
                  RETRIEVE_PRODUCT_FEATURES
                  <value>http://apptuvirtual054.machine.test.group:12301/aft/retrieveProductConditions</value>
            </tag>
            <tag>
                  ARRANGE_PRODUCT
                  <value>http://apptuvirtual054.machine.test.group:12302/aft/offerProductArrangement</value>
            </tag>
            <tag>
                  ACTIVATE_PRODUCT_ARRANGEMENT
                  <value>http://apptuvirtual054.machine.test.group:12304/aft/productActivation</value>
            </tag>
            <tag>
                  USERNAME_VALIDATION
                  <value>http://10.245.211.198:8731</value>
            </tag>
            <tag>
            	THREAT_MATRIX
            	<value>http://10.245.211.251:22910/host/threadmatrix/</value>
            </tag>
            <tag>
            	BAPI_AUDITING
            	<value>http://10.245.211.198:8731/fserv/</value>
             </tag>
      </section>
      <section>
            DEVICE_URL
            <tag>
                  LLOYDS
                  <value>https://check2.lloydsbank.co.uk</value>
            </tag>
            <tag>
                  HALIFAX
                  <value>https://check2.halifax-online.co.uk</value>
            </tag>
            <tag>
                  BOS
                  <value>https://check2.bankofscotland.co.uk</value>
            </tag>
            <tag>
                  VERDE
                  <value>https://check2.tsb.co.uk</value>
            </tag>
            <tag>
                  LLOYDSBANK
                  <value>https://check2.lloydsbank.co.uk</value>
            </tag>
      </section>
      <section>
            THREAT_MATRIX_ORG_ID
            <tag>
                  LLOYDS
                  <value>g17j1ysn</value>
            </tag>
            <tag>
                  HALIFAX
                  <value>g17j1ysn</value>
            </tag>
            <tag>
                  BOS
                  <value>g17j1ysn</value>
            </tag>
            <tag>
                  LLOYDSBANK
                  <value>g17j1ysn</value>
            </tag>
            <tag>
                  VERDE
                  <value>8vzkivup</value>
            </tag>
      </section>
      <section>
            TIMEOUTS
            <tag>
                  SOAP_COMMUNICATOR_TIMEOUT_IN_MILLIS
                  <value>5000</value>
            </tag>
            <tag>
                  CONTENT_SERVICE_BACKEND_CALL_TIMEOUT_IN_MILLIS
                  <value>5000</value>
            </tag>
      </section>
	<section>
		API_SERVICE_ENDPOINTS
		<tag>
			ADDRESS_SEARCH
			<value>http://apptuvirtual054.machine.test.group:12305/aft/InformationProvisionService</value>
		</tag>
		<tag>
			RETRIEVE_PRODUCT_FEATURES
			<value>http://apptuvirtual054.machine.test.group:12301/aft/retrieveProductConditions</value>
		</tag>
		<tag>
			ARRANGE_PRODUCT
			<value>http://apptuvirtual054.machine.test.group:12302/aft/offerProductArrangement</value>
		</tag>
		<tag>
			ACTIVATE_PRODUCT_ARRANGEMENT
			<value>http://apptuvirtual054.machine.test.group:12304/aft/productActivation</value>
		</tag>
		<tag>
			USERNAME_VALIDATION
			<value>http://10.245.211.198:8731</value>
		</tag>
	</section>
	<section>
		DEVICE_URL
		<tag>
			LLOYDS
			<value>https://check2.lloydsbank.co.uk</value>
		</tag>
		<tag>
			HALIFAX
			<value>https://check2.halifax-online.co.uk</value>
		</tag>
		<tag>
			BOS
			<value>https://check2.bankofscotland.co.uk</value>
		</tag>
		<tag>
			VERDE
			<value>https://check2.tsb.co.uk</value>
		</tag>
		<tag>
			LLOYDSBANK
			<value>https://check2.lloydsbank.co.uk</value>
		</tag>
	</section>
	<section>
		THREAD_METRIX_ORG_ID
		<tag>
			LLOYDS
			<value>g17j1ysn</value>
		</tag>
		<tag>
			HALIFAX
			<value>g17j1ysn</value>
		</tag>
		<tag>
			BOS
			<value>g17j1ysn</value>
		</tag>
		<tag>
			LLOYDSBANK
			<value>g17j1ysn</value>
		</tag>
		<tag>
			VERDE
			<value>8vzkivup</value>
		</tag>
	</section>
	<section>
		CONTENTSERVICE_URL_BRAND_NSP
		<tag>
			LTSBRetail
			<value>LLOYDS/</value>
		</tag>
		<tag>
			BOSRetail
			<value>BOS/</value>
		</tag>
	</section>
	<section>
			CONTENTSERVICE_URL_RESOURCE_BUNDLE_NSP
		<tag>
			LTSBRetail
			<value>lloydsResource</value>
		</tag>
		<tag>
			BOSRetail
			<value>bosResource</value>
		</tag>
	</section>
	<section>
		IIS_CMS_SERVER_URL_NSP
		<tag>
			LTSBRetail
			<value>http://appduv00bd.machine.test.group:7772/</value>
		</tag>
		<tag>
			BOSRetail
			<value>http://appduv00bd.machine.test.group:7772/</value>
		</tag>
	</section>
	<section>
		CONTENT
		<tag>
			LTSBRetail
			<value>http://appduv00bd.machine.test.group:7772/LLOYDS/</value>
		</tag>
		<tag>
			BOSRetail
			<value>http://appduv00bd.machine.test.group:7772/BOS/</value>
		</tag>
	</section>
	<section>
		TIMEOUTS
		<tag>
			SOAP_COMMUNICATOR_TIMEOUT_IN_MILLIS
			<value>5000</value>
		</tag>
		<tag>
			CONTENT_SERVICE_BACKEND_CALL_TIMEOUT_IN_MILLIS
			<value>5000</value>
		</tag>
	</section>
</root>
