<?xml version="1.0"?>
<!DOCTYPE Root SYSTEM "./config.dtd">
<root>	
	<section>LOGGER_FACTORY		
		<tag>
			SERVICE_LOGGER
			<value>com.lloydstsb.ea.logging.impl.LoggingServiceImpl</value>
		</tag>
		<tag>
			ACTIVITY_LOGGER
			<value>com.lloydstsb.ea.logging.impl.ActivityLoggerImpl</value>
		</tag>
		<tag>
			AUDIT_LOGGER
			<value>com.lloydstsb.ea.logging.impl.AuditLoggerImpl</value>
		</tag>
		<tag>
			DEBUG_LOGGER
			<value>com.lloydstsb.ea.logging.impl.DebugLoggerImpl</value>
		</tag>
		<tag>
			ERROR_LOGGER
			<value>com.lloydstsb.ea.logging.impl.ErrorLoggerImpl</value>
		</tag>
		<tag>
			METRIC_LOGGER
			<value>com.lloydstsb.ea.logging.impl.MetricLoggerImpl</value>
		</tag>
		<tag>
			PERFORMANCE_LOGGER
			<value>com.lloydstsb.ea.logging.impl.PerformanceLoggerImpl</value>
		</tag>
		<tag>
			STATE_LOGGER
			<value>com.lloydstsb.ea.logging.impl.StateLoggerImpl</value>
		</tag>
		<tag>
			TRACE_LOGGER
			<value>com.lloydstsb.ea.logging.impl.TraceLoggerImpl</value>
		</tag>
		<tag>
			WARNING_LOGGER
			<value>com.lloydstsb.ea.logging.impl.WarningLoggerImpl</value>
		</tag>
		<tag>
			EXCEPTION_LOGGER
			<value>com.lloydstsb.ea.logging.impl.ExceptionLoggerImpl</value>
		</tag>
		<tag>
			ALERT_LOGGER
			<value>com.lloydstsb.ea.logging.impl.AlertLoggerImpl</value>
		</tag>
	</section>
</root>
