<?xml version="1.0" encoding="UTF-8"?>
<!DOCTYPE Root SYSTEM "./config.dtd">
<root>
      <section>
            DAO_INVOCATION_HANDLER
            <tag>
                  DAOTHROTTLE
                   <value>ThrottleBehavior</value>
            </tag>            
      </section>
      <section>
            ThrottleBehavior
            <tag>
                  ClassName
                   <value>com.lloydstsb.ea.dao.dynamicproxies.DAOThrottleBehavior</value>
            </tag>
            <tag>
                  Order
                   <value>1</value>
            </tag>            
      </section>      
</root>