<?xml version="1.0"?>
<!DOCTYPE Root SYSTEM "./config.dtd">
<root>
    <section>FORCED_LOGOFF_REDIRECT_URLS
        <tag>
            FORCED_LOGOFF_REDIRECT_TO_LOGIN 
            <value>&FORCED_LOGOFF_REDIRECT_TO_LOGIN;</value>                                   
        </tag>
        <tag>
            FORCED_LOGOFF_REDIRECT_TO_SORRY_PAGE_1   
            <value>&FORCED_LOGOFF_REDIRECT_TO_SORRY_PAGE_1;</value>                                 
        </tag>
        <tag>
            FORCED_LOGOFF_REDIRECT_TO_SORRY_PAGE_2 
            <value>&FORCED_LOGOFF_REDIRECT_TO_SORRY_PAGE_2;</value>                                   
        </tag>
        <tag>
            FORCED_LOGOFF_REDIRECT_TO_SORRY_PAGE_3   
            <value>&FORCED_LOGOFF_REDIRECT_TO_SORRY_PAGE_3;</value>                                 
        </tag>
        <tag>
            FORCED_LOGOFF_REDIRECT_TO_UNAVAILABLE_PAGE   
            <value>&FORCED_LOGOFF_REDIRECT_TO_UNAVAILABLE_PAGE;</value>                                 
        </tag>
    </section>
</root>