<?xml version="1.0"?>
<!DOCTYPE Root SYSTEM "./config.dtd">
<root>
	<!---LLOYDS PRODUCTS-->
	<section>
		PRODUCTS_LLOYDS_ED
		<tag>
			FIRST
			<value>P_CLASSIC</value>
		</tag>
		<tag>
			SECOND
			<value>P_PLAT_CLB</value>
		</tag>
		<tag>
			THIRD
			<value>P_NEW_BASIC</value>
		</tag>
		<tag>
			FOURTH
			<value>P_CLUB</value>
		</tag>
		<tag>
			FIFTH
			<value>P_PLAT</value>
		</tag>
	</section>

	<section>
		PRODUCTS_LLOYDS_STUDENT
		<tag>
			FIRST
			<value>P_NEW_BASIC</value>
		</tag>
		<tag>
			SECOND
			<value>P_STUDENT</value>
		</tag>

	</section>

	<section>
		PRODUCTS_LLOYDS_YOUTH
		<tag>
			FIRST
			<value>P_UNDER19</value>
		</tag>
	</section>
	<!---END LLOYDS PRODUCTS-->

	<!---BOS PRODUCTS-->
	<section>
		PRODUCTS_BOS_ED
		<tag>
			FIRST
			<value>P_CLASSIC</value>
		</tag>
		<tag>
			SECOND
			<value>P_NEW_BASIC</value>
		</tag>

		<tag>
			THIRD
			<value>P_PLAT</value>
		</tag>
	</section>

	<section>
		PRODUCTS_BOS_STUDENT
		<tag>
			FIRST
			<value>P_STUDENT</value>
		</tag>
		<tag>
			SECOND
			<value>P_NEW_BASIC</value>
		</tag>
	</section>

	<section>
		PRODUCTS_BOS_YOUTH
		<tag>
			FIRST
			<value>P_UNDER19</value>
		</tag>
	</section>
	<!---END BOS PRODUCTS-->

	<!---HALIFAX PRODUCTS-->
	<section>
		PRODUCTS_HALIFAX_ED
		<tag>
			FIRST
			<value>P_REWARD</value>
		</tag>
		<tag>
			SECOND
			<value>P_ULTIMATE</value>
		</tag>
		<tag>
			THIRD
			<value>P_NEW_BASIC</value>
		</tag>
	</section>

	<section>
		PRODUCTS_HALIFAX_STUDENT
		<tag>
			FIRST
			<value>P_STUDENT</value>
		</tag>
		<tag>
			SECOND
			<value>P_NEW_BASIC</value>
		</tag>
	</section>

	<section>
		PRODUCTS_HALIFAX_YOUTH
		<tag>
			FIRST
			<value>P_EXPRESSCASH</value>
		</tag>
	</section>
	<!---END HALIFAX PRODUCTS-->
	
	<!---BANKRUPTCY PRODUCTS-->
	<section>
		BANKRUPTCY_PRODUCT_KEY
		<tag>
			FIRST
			<value>P_NEW_BASIC</value>
		</tag>
		<tag>
			SECOND
			<value>P_CLASSIC</value>
		</tag>
	</section>
	
	<section>
		HALIFAX_BANKRUPTCY_PRODUCT_KEY
		<tag>
			FIRST
			<value>P_NEW_BASIC</value>
		</tag>
		<tag>
			SECOND
			<value>P_REWARD</value>
		</tag>
	</section>
		
	<!---END OF BANKRUPTCY PRODUCTS-->
	
	
	<!--PRODUCTS LIST-->
	
	<section>
		LLOYDS_PRODUCTS_LIST
		<tag>
			FIRST
			<value>P_CLASSIC</value>
		</tag>
		<tag>
			SECOND
			<value>P_CLUB</value>
		</tag>
		<tag>
			THIRD
			<value>P_NEW_BASIC</value>
		</tag>
		<tag>
			FOURTH
			<value>P_PLAT</value>
		</tag>	
		<tag>
			FIFTH
			<value>P_PLAT_CLB</value>
		</tag>	
		<tag>
			SIXTH
			<value>P_STUDENT</value>
		</tag>	
		<tag>
			SEVENTH
			<value>P_UNDER19</value>
		</tag>
		<tag>
			EIGHTH
			<value>P_CASH</value>
		</tag>
		<tag>
			NINETH
			<value>P_GRADUATE</value>
		</tag>
		<tag>
			TENTH
			<value>P_SELECT</value>
		</tag>
		<tag>
			ELVENTH
			<value>P_SILVER</value>
		</tag>
		<tag>
			TWELVETH
			<value>P_GOLD</value>
		</tag>
		<tag>
			THIRTEENTH
			<value>P_PREMIER</value>
		</tag>							
	</section>

	<section>
		BOS_PRODUCTS_LIST
		<tag>
			FIRST
			<value>P_CLASSIC</value>
		</tag>
		<tag>
			SECOND
			<value>P_NEW_BASIC</value>
		</tag>
		<tag>
			THIRD
			<value>P_PLAT</value>
		</tag>
		<tag>
			FOURTH
			<value>P_UNDER19</value>
		</tag>	
		<tag>
			FIFTH
			<value>P_STUDENT</value>
		</tag>	
		<tag>
			SIXTH
			<value>P_CLSCVTG</value>
		</tag>
		<tag>
			SEVENTH
			<value>P_PLATVTG</value>
		</tag>
		<tag>
			EIGHTH
			<value>P_CASH</value>
		</tag>
		<tag>
			NINETH
			<value>P_GRADUATE</value>
		</tag>
		<tag>
			TENTH
			<value>P_ULTIMATE</value>
		</tag>
		<tag>
			ELVENTH
			<value>P_SILVER</value>
		</tag>
		<tag>
			TWELVETH
			<value>P_GOLD</value>
		</tag>
		<tag>
			THIRTEENTH
			<value>P_PREMIER</value>
		</tag>
	</section>
	
	
	<section>
		HALIFAX_PRODUCTS_LIST
		<tag>
			FIRST
			<value>P_REWARD</value>
		</tag>
		<tag>
			SECOND
			<value>P_ULTIMATE</value>
		</tag>
		<tag>
			THIRD
			<value>P_NEW_BASIC</value>
		</tag>
		<tag>
			FOURTH
			<value>P_STUDENT</value>
		</tag>	
		<tag>
			FIFTH
			<value>P_EXPRESSCASH</value>
		</tag>
		<tag>
			SIXTH
			<value>P_STANDARD</value>
		</tag>	
								
	</section>	

	<!--END OF PRODUCTS LIST-->
</root>