<?xml version="1.0"?>
<!DOCTYPE Root SYSTEM "./config.dtd">
<root>
       <section>
              RefreshSchedulerConfig
              
              <tag>
                     ReferenceDataRefreshScheduler.name
                     <value>ReferenceDataRefreshScheduler</value>
              </tag>
       </section>
       <!-- Added the MMRefDataRefreshScheduler for Money Manager Reference Data Refresh -->
       <section>
              LoadOnStartUp
              <tag>
                     InitialDelay
                     <value>5000</value>
              </tag>
       </section>      
      
       <!-- TMX fuse changes starts -->
       <section>
              FuseRetrievalScheduler
              <tag>
                     ClassName
                     <value>
                            com.lloydstsb.ea.scheduler.FuseRetrievalScheduler
                     </value>
              </tag>
              <tag>
                     LoadOnStartUp
                     <value>true</value>
              </tag>
              <tag>
                     RefreshType
                     <value>Regular</value>
              </tag>
              <tag>
                     RefreshTime
                     <value>60</value>
              </tag>
       </section>
       <section>
              FuseStateTransitionScheduler
              <tag>
                     ClassName
                     <value>
                            com.lloydstsb.ea.scheduler.FuseStateTransitionScheduler
                     </value>
              </tag>
              <tag>
                     LoadOnStartUp
                     <value>true</value>
              </tag>
              <tag>
                     RefreshType
                     <value>Regular</value>
              </tag>
              <tag>
                     RefreshTime
                     <value>60</value>
              </tag>
       </section>
</root>