<?xml version="1.0"?>
<!DOCTYPE Root SYSTEM "./config.dtd">
<root>
	<section>
	CURRENT_ACCOUNTS
	<tag>
		BTRPCA
		<value>GG_RETAIL_BRANCH_PCA_SELLER</value>
	</tag>
</section>
	<section>
		DOCUMENT_RETRIEVAL
		<tag>
			BTRPCA_01
			<value>GG_OAP_DOWNLOAD_01</value>
		</tag>
		<tag>
			BTRPCA_02
			<value>GG_OAP_DOWNLOAD_02</value>
		</tag>
		<tag>
			BTRPCA_03
			<value>GG_OAP_DOWNLOAD_03</value>
		</tag>						
	</section>
	
	<section>
		SAVENRESUMEWRITE
		<tag>
			BTRPCA_08
			<value>GG_RETAIL_BRANCH_AML_ACCRED</value>
		</tag>
	</section>
</root>