<?xml version="1.0"?>
<!DOCTYPE root SYSTEM "./config.dtd">
<root>
    <section>
        API_SERVICE_ENDPOINTS
        <tag>
            ADDRESS_SEARCH
            <!--<value><![CDATA[http://apigwproxy.lbg.eu-gb.mybluemix.net/sandbox-team-dev/dev/secure/InformationProvisionService?client_id=faf3ad00-0fa5-4d9c-92ae-1252e960fc2f&client_secret=lP7hU6wH5mL1kV4uF1kY0eW2mS8hU6gX0bM3uO0fJ8lB3sW6lV]]></value>-->
            <value>http://pca-stubs-client-master.lbg.eu-gb.mybluemix.net/stub/</value>
        </tag>
        <tag>
           RECORD_ARRANGEMENT_QUESTIONNAIRE_SERVICE
           <value><![CDATA[http://apigwproxy.lbg.eu-gb.mybluemix.net/sandbox-team-dev/dev/secure/wps/sales/v1.0/recordArrangementQuestionnaireResult?client_id=ebe44084-3522-4bb5-b080-784dfb400cab&client_secret=X4qE2oK6kW6gW6uA6gS5iP3eL3eR4gK5sD8hL1tS7sJ8yN5iO3]]></value>
         </tag>

		<tag>
            PRODUCT_HOLDING
            <!--<value>http://pao-service-stubs-sprint8-aco-mockservice.lbg.eu-gb.mybluemix.net/AccountsStub</value>-->
        	<value>http://pca-stubs-client-master.lbg.eu-gb.mybluemix.net/PCAAccountsStub</value>
        </tag>
         <tag>
			RETRIEVE_ARRANGEMENT_QUESTIONNAIRE_SERVICE
 			<value><![CDATA[http://apigwproxy.lbg.eu-gb.mybluemix.net/sandbox-team-dev/dev/secure/wps/sales/v1.0/retrieveArrangementQuestionnaire?client_id=ebe44084-3522-4bb5-b080-784dfb400cab&client_secret=X4qE2oK6kW6gW6uA6gS5iP3eL3eR4gK5sD8hL1tS7sJ8yN5iO3]]></value>
        </tag>
        <tag>
            TOKEN_VALIDATION
           <!--<value><![CDATA[https://public_apim_dev.lbg.eu-gb.bluemix.net/sandbox-team-dev/secure/InformationProvisionService?client_id=faf3ad00-0fa5-4d9c-92ae-1252e960fc2f&client_secret=lP7hU6wH5mL1kV4uF1kY0eW2mS8hU6gX0bM3uO0fJ8lB3sW6lV]]></value>-->
           <value><![CDATA[http://pca-stubs-client-master.lbg.eu-gb.mybluemix.net/PCAInvolvedPartyAuthorisationService]]></value>
        </tag>
    </section>

    <section>
        DEVICE_URL
        <tag>
            LLOYDS
            <value>https://check2.lloydsbank.co.uk</value>
        </tag>
        <tag>
            HALIFAX
            <value>https://check2.halifax-online.co.uk</value>
        </tag>
        <tag>
            BOS
            <value>https://check2.bankofscotland.co.uk</value>
        </tag>
        <tag>
            VERDE
            <value>https://check2.tsb.co.uk</value>
        </tag>
        <tag>
            LLOYDSBANK
            <value>https://check2.lloydsbank.co.uk</value>
        </tag>
    </section>

    <section>
        ThreatMetrixOrgID
        <tag>
            LLOYDS
            <value>g17j1ysn</value>
        </tag>
        <tag>
            HALIFAX
            <value>g17j1ysn</value>
        </tag>
        <tag>
            BOS
            <value>g17j1ysn</value>
        </tag>
        <tag>
            LLOYDSBANK
            <value>g17j1ysn</value>
        </tag>
        <tag>
            VERDE
            <value>8vzkivup</value>
        </tag>
    </section>

	<section>
		ThreatMetrixApiKey
		<tag>
			LLOYDS
			<value>irit8diagzvsojwmttfduhaj3tv9yuig</value>
		</tag>
		<tag>
			HALIFAX
			<value>irit8diagzvsojwmttfduhaj3tv9yuig</value>
		</tag>
		<tag>
			BOS
			<value>irit8diagzvsojwmttfduhaj3tv9yuig</value>
		</tag>
		<tag>
			LLOYDSBANK
			<value>irit8diagzvsojwmttfduhaj3tv9yuig</value>
		</tag>
		<tag>
			VERDE
			<value>irit8diagzvsojwmttfduhaj3tv9yuig</value>
		</tag>
	</section>
	
	<section>
        CONTENT
        <tag>
            LTSBRetail
            <value>http://sit-ib-pres-svr-content.service.test.group/wps/wcm/connect/devpreview_teamsite_lloyds_personal_banking/en/LloydsPersonalBanking/cwa/</value>
        </tag>
        <tag>
            BOSRetail
            <!-- <value>http://sit-ib-pres-svr-content.service.test.group/wps/wcm/connect/devpreview_teamsite_bos_personal_banking/en/BosPersonalBanking/cwa/</value> -->
            <value>http://apigwproxy.lbg.eu-gb.mybluemix.net/sandbox-team-dev/dev/content_secure/en/BosPersonalBanking/cwa/</value>
        </tag>
        <tag>
            HalifaxRetail
            <value>http://sit-ib-pres-svr-content.service.test.group/wps/wcm/connect/devpreview_teamsite_halifax_personal_banking/en/HalifaxPersonalBanking/cwa/</value>
        </tag>
    </section>
	<section>
		CONTENTSERVICE_URL_BRAND_NSP
		<tag>
			LTSBRetail
			<value>LloydsPersonalBanking/cwa/</value>
		</tag>
		<tag>
			BOSRetail
			<value>BosPersonalBanking/cwa/</value>
		</tag>
		<tag>
			HalifaxRetail
			<value>HalifaxPersonalBanking/cwa/</value>
		</tag>
	</section>
	
	<section>
        CONTENTSERVICE_URL_RESOURCE_BUNDLE_NSP
        <tag>
            LTSBRetail
            <value>sandbox-team-dev/sb/CG/content_secure/testpreview_teamsite_lloyds_personal_banking/</value>
        </tag>
        <tag>
            BOSRetail
            <value>sandbox-team-dev/sb/CG/content_secure/testpreview_teamsite_bos_personal_banking</value>
        </tag>
		<tag>
            HalifaxRetail
            <value>sandbox-team-dev/sb/CG/content_secure/testpreview_teamsite_halifax_personal_banking/</value>
        </tag>
    </section>

	<!-- <section>
		CONTENTSERVICE_URL_RESOURCE_BUNDLE_NSP
		<tag>
			LTSBRetail
			<value>devpreview_teamsite_lloyds_personal_banking</value>
		</tag>
		<tag>
			BOSRetail
			<value>devpreview_teamsite_bos_personal_banking</value>
		</tag>
		<tag>
			HalifaxRetail
			<value>devpreview_teamsite_halifax_personal_banking</value>
		</tag>
	</section> -->
	
	<section>
        IIS_CMS_SERVER_URL_NSP
        <tag>
            LTSBRetail
            <value>http://apigwproxy.lbg.eu-gb.mybluemix.net/</value>
        </tag>
        <tag>
            BOSRetail
            <value>http://apigwproxy.lbg.eu-gb.mybluemix.net/</value>
        </tag>
		<tag>
            HalifaxRetail
            <value>http://apigwproxy.lbg.eu-gb.mybluemix.net/</value>
        </tag>
    </section>

   <!--  <section>
        IIS_CMS_SERVER_URL_NSP
        <tag>
            LTSBRetail
            <value>http://pao-mock-service.lbg.eu-gb.mybluemix.net/content/wps/wcm/connect/</value>
        </tag>
        <tag>
            BOSRetail
            <value>http://pao-mock-service.lbg.eu-gb.mybluemix.net/content/wps/wcm/connect/</value>
        </tag>
		<tag>
            HalifaxRetail
            <value>http://pao-mock-service.lbg.eu-gb.mybluemix.net/content/wps/wcm/connect/</value>
        </tag>
    </section> --> 
    
    <section>
        CONTENTSERVICE_CLIENT_ID
        <tag>
            LTSBRetail
            <value>client_id=ddd443a0-02ef-499b-9fb5-b5b9b736487d</value>
        </tag>
        <tag>
            BOSRetail
            <value>client_id=ddd443a0-02ef-499b-9fb5-b5b9b736487d</value>
        </tag>
		<tag>
            HalifaxRetail
            <value>client_id=ddd443a0-02ef-499b-9fb5-b5b9b736487d</value>
        </tag>
    </section>
    
    <section>
        CONTENTSERVICE_CLIENT_SECRET
        <tag>
            LTSBRetail
            <value>client_secret=pR4yU3sG8lI0qK3iR4wQ3cK6dL6bS0xY3gQ3aD8gS5kM5rB3sU</value>
        </tag>
        <tag>
            BOSRetail
            <value>client_secret=pR4yU3sG8lI0qK3iR4wQ3cK6dL6bS0xY3gQ3aD8gS5kM5rB3sU</value>
        </tag>
		<tag>
            HalifaxRetail
            <value>client_secret=pR4yU3sG8lI0qK3iR4wQ3cK6dL6bS0xY3gQ3aD8gS5kM5rB3sU</value>
        </tag>
    </section>

	<section>
        SERVICES_CLIENT_ID
        <tag>
            PAMDB
            <value>client_id=ebe44084-3522-4bb5-b080-784dfb400cab</value>
        </tag>
    </section>
    
    <section>
        SERVICES_CLIENT_SECRET
        <tag>
            PAMDB
            <value>client_secret=X4qE2oK6kW6gW6uA6gS5iP3eL3eR4gK5sD8hL1tS7sJ8yN5iO3</value>
        </tag>
    </section>

	<section>
		TIMEOUTS
		<tag>
			SOAP_COMMUNICATOR_TIMEOUT_IN_MILLIS
			<value>5000</value>
		</tag>
		<tag>
			CONTENT_SERVICE_BACKEND_CALL_TIMEOUT_IN_MILLIS
			<value>5000</value>
		</tag>
	</section>
	<section>
		PRODUCT_SELECTOR_CONTENT
		<tag>
			CONTENT_PATH
			<value>savings/product/product_mnemonic</value>
		</tag>
		<tag>
			CONTENT_SERVICE_BACKEND_CALL_TIMEOUT_IN_MILLIS
			<value>5000</value>
		</tag>
	</section>
    <section>
        com.lloydstsb.gx.GalaxySystemParameter
        <tag>
            lloyds.client.web.application.container.uri
            <value>http://pca-stubs-client-master.lbg.eu-gb.mybluemix.net</value>
        </tag>
    </section>
    <section>
        IIS_CMS_SERVER_CONTEXT
        <tag>
            content.context.uri
            <value>ib/pb/cwa/refdata/pca-ref-data/</value>
        </tag>
    </section>
</root>
