<?xml version="1.0"?>
<!DOCTYPE Root SYSTEM "./config.dtd">
<root>
	<section>
		ApplicationContext
		<tag>
			APPLICATION_CONTEXT_APPLICATION_NAME
			<value>IB</value>
		</tag>
	</section>
	<section>
		ApplicationRequestContext
		<tag>
			APPLICATION_CONTEXT_CHANNEL
			<value>IBL</value>
		</tag>
		<tag>
			APPLICATION_CONTEXT_COMPONENT_NAME
			<value>Web IB</value>
		</tag>
		<tag>
			APP_TYPE_BRANCH
			<value>Branch</value>
		</tag>
		<tag>
			APP_TYPE_TELEPHONY
			<value>Telephony</value>
		</tag>
		<tag>
			APPLICATION_CONTEXT_COMPONENT_NAME_BRANCH
			<value>Branch Banking</value>
		</tag>
		<tag>
			APPLICATION_CONTEXT_COMPONENT_NAME_TELEPHONY
			<value>Telephony Banking</value>
		</tag>
	</section>
</root>