<?xml version="1.0"?>
<!DOCTYPE Root SYSTEM "./config.dtd">
<root>
    <section>
        CHANNEL_MOBILE_SUPPORT
        <tag>
            LTSBRetail
            <value>1</value>
        </tag>
        <tag>
            LTSBCommercial
            <value>0</value>
        </tag>
        <tag>
            BOSRetail
            <value>1</value>
        </tag>
        <tag>
            BOSCommercial
            <value>0</value>
        </tag>
        <tag>
            HalifaxRetail
            <value>1</value>
        </tag>
        <!--  Verde Changes - UI layer - starts -->
        <tag>
            VerdeRetail
            <value>0</value>
        </tag>
        <tag>
            VerdeCommercial
            <value>0</value>
        </tag>
        <!--  Verde Changes - UI layer - ends -->

    </section>
 
</root>