<?xml version="1.0"?>
<!DOCTYPE Root SYSTEM "./config.dtd">
<root>
	<section>
		commonValue
		<tag>
			configured_logOff_count
			<value>-1</value>
		</tag>
	</section>
	<section>
		leadMsg
		<tag>
			age_limit
			<value>16</value>
		</tag>
	</section>
	<section>
		meminfo
		<tag>
			accesstoken_length
			<value>16</value>
		</tag>
	</section>
	<section>
		SessionConfiguration
		<tag>
			DefaultArrangementReminderDays
			<value>90</value>
		</tag>
		<tag>
			PrefetchWaitTime
			<value>60000</value>
		</tag>
		<tag>
			ThreadSleepTime
			<value>500</value>
		</tag>
		<tag>
			DefaultNoOfWorkerThreadsToTrigger
			<value>5</value>
		</tag>
	</section>
	<section>
		MobileFasterPaymentConfiguration
		<tag>
			FasterPaymentWaitTime
			<value>3000</value>
		</tag>
		<tag>
			ThreadSleepTime
			<value>500</value>
		</tag>
	</section>

	<section>
		logBackURL
		<tag>
			LoginURL
			<value>&INVALID_SESSION_FORCED_LOGOFF_REDIRECT_URL;</value>
		</tag>
	</section>
	<!--  International Payment reference Data loader -->
	<section>
		INTERNATIONAL_PAYMENT_LOADER_SETTING
		<tag>
			CLASSIFICATION_KEY
			<value>InternationalPayment</value>
		</tag>
	</section>
	<!--  Mobile Interstitial LEADS URL possible values -->
	<section>
		LEADS_URL_VALUES
		<tag>
			TELE_LINK
			<value>tel:</value>
		</tag>
	</section>
	<!--  Flag to identify whether we should allow future dated statements, to be changed via x-path, added for paperless -->
	<section>
		B2K_VIEW_STATEMENTS
		<tag>
			ALLOW_FUTURE_DATED_STATEMENTS
			<value>false</value>
		</tag>
	</section>
	<!--  Minimum loan amount customer can borrow in Eloan refinance -->
	<section>
		Eloan_Refinance_Min_Amount
		<tag>
			Min_Loan_Amount
			<value>1000</value>
		</tag>
	</section>
	<!--  ISA Transfer reference Data loader -->
	<section>
		ISA_TRANSFER_LOADER_SETTING
		<tag>
			CLASSIFICATION_KEY
			<value>ISATransfer</value>
		</tag>
	</section>
	<!-- Added for Sampson -->
	<section>
        UnauthURL
        <tag>
          	LLOYDS
             <value>https://apply.lloydsbank.co.uk/personal/a</value>
        </tag>
    </section>
</root>
