<?xml version="1.0" encoding="UTF-8"?>
<!DOCTYPE Root SYSTEM "./config.dtd">
<root>
    <section>
        Default
        <tag type="string">
            LaunchURL
            <value type="string">/logon/login.jsp</value>
        </tag>
        <!-- EA component config file change : start -->
        <tag>
            RegisterURL
            <value>
                /a/registration/onlinepersonalregistration.jsp
            </value>
        </tag>
        <tag type="String">
            URLPattern
            <value type="string">/mobile</value>
        </tag>
        <tag type="String">
            ForwardMode
            <value type="string">true</value> <!-- true for unauth and false for auth environment -->
        </tag>
        <tag type="String">
            RedirectURL
            <value type="string">/useradmin/mobile/logon/login.jsp</value>
        </tag>
        <tag>
            RedirectRegisterURL
            <value>
                /a/useradmin/mobile/registration/selectaccounttyperegistration.jsp
            </value>
        </tag>
         <tag>
            NGB_DEVICE_DETECTION
            <value>true</value><!-- true to enable NGB device detection -->
        </tag>
                <tag>
            NGB_CAPABILITIES_CACHING
            <value>true</value><!-- true to enable NGB capabilities caching -->
        </tag>
        <tag type="String">
            ErrorPagePasswordURL
            <value type="string">/a/common/mobile/errorpagepassword.jsp</value>
        </tag>
            <tag type="String">
            BrappBlockedURL
            <value type="string">/unauth/pages/Blockbrapppage.jsp</value>
        </tag>
        <tag>
            AuthenticationFailedURL
            <value>
                /unauth/pages/errorpageauthenticationfailed.jsp
            </value>
        </tag>
        <tag type="String">
            BrappBlockedURL
            <value>
                /unauth/pages/Blockbrapppage.jsp
            </value>
        </tag>
        <tag>
            AuthenticationFailedURL
            <value>
                /unauth/pages/errorpageauthenticationfailed.jsp
            </value>
        </tag>
        <tag type="String">
            APP_PARAM
            <value>
                app
            </value>
        </tag>
        <tag type="String">
            APP_PARAM_VALUE
            <value>
                brapp
            </value>
        </tag>
        
        <tag>
            HUB_PAGE_URL
            <value>
                /a/viewaccount/accountoverviewpersonalbase.jsp
            </value>
        </tag>
         <tag>
            STACK_TYPE
            <value>&STACK;</value>
        </tag>
        
    </section>
    <section>
        UnAuthNonBookmarkURL
        <tag>
            ErrorPagePasswordURL
            <value>/a/common/mobile/errorpagepassword.jsp</value>
        </tag>
        <tag>
            SelectAccountTypeRegistration
            <value>
                /a/useradmin/mobile/registration/selectaccounttyperegistration.jsp
            </value>
        </tag>
        <tag>
            OnlinePersonalRegistration
            <value>
                /a/useradmin/mobile/registration/onlinepersonalregistration.jsp
            </value>
        </tag>
        <!-- EA component config file change : start -->
        <tag >
            OnlineRegistration
            <value >
                /a/registration/onlinepersonalregistration.jsp
            </value>
        </tag>
        <!-- EA component config file change : end -->
        
        <tag>
            ErrorPageLoggedOut
            <value>/a/common/mobile/errorpageloggedout.jsp</value>
        </tag>
        <tag>
            HelpDeskAuthorization
            <value>
                /a/useradmin/mobile/registration/helpdeskauthorization.jsp
            </value>
        </tag>
        <tag>
            SuccessRegistration
            <value>
                /a/useradmin/mobile/registration/successregistration.jsp
            </value>
        </tag>
        <tag>
            TermsAndConditions
            <value>
                /a/useradmin/mobile/registration/termsandconditions.jsp
            </value>
        </tag>

    </section>
    <section>
        AUTH_LOGGED_OFF_PAGES

        <tag>
            /unauth/pages/mobiledefault/paymentdeclined.jsp
            <value>/unauth/pages/mobiledefault/paymentdeclined.jsp</value>
        </tag>
        <tag>
            /unauth/pages/mobiledefault/phoneauthfailurefraudsuspected.jsp
            <value>/unauth/pages/mobiledefault/phoneauthfailurefraudsuspected.jsp
            </value>
        </tag>
        <tag>
            /unauth/pages/mobiledefault/errorpagepassword.jsp
            <value>/unauth/pages/mobiledefault/errorpagepassword.jsp</value>
        </tag>
        <tag>
            /unauth/pages/errorpageauthenticationfailed.jsp
            <value>/unauth/pages/errorpageauthenticationfailed.jsp</value>
        </tag>

    </section>
    <section>
        WURFL_MANDATE_CAPABILITIES
        <tag>
            mobile_browser
            <value>null</value>
        </tag>
        <tag>
            is_wireless_device
            <value>null</value>
        </tag>
        <tag>
            is_tablet
            <value>null</value>
        </tag>
        <tag>
            device_os_version
            <value>null</value>
        </tag>
        <tag>
            device_os
            <value>null</value>
        </tag>
        <tag>
            preferred_markup
            <value>null</value>
        </tag>
        <tag>
            resolution_height
            <value>null</value>
        </tag>
        <tag>
            resolution_width
            <value>null</value>
        </tag>
        <tag>
            ux_full_desktop
            <value>null</value>
        </tag>
        <tag>
            xhtml_support_level
            <value>null</value>
        </tag>
    </section>
    <section>
        GALAXY_SPECIFIC_CAPABILITIES
        <tag>
            screen_diagonal
            <value>physical_screen_width:physical_screen_height</value>
        </tag>
    </section>
    <section>
        DEVICE_SNIFFING_BLOCK_ERROR
        <tag>
            ERROR_CODE
            <value>3200008</value>
        </tag>
        <tag>
            ERROR_DESC
            <value>Prevent the device accessing the journey</value>
        </tag>
    </section>

</root>