<?xml version="1.0"?>
<!DOCTYPE Root SYSTEM "./config.dtd">

<root>
     <section>
        DOC_UPLOAD_SWITCH
        <tag>
            BRANDED_SWITCH
            <value>SW_EnDcUpldRApi</value>
        </tag>
    </section>

    <section>
        DOC_UPLOAD_SAVE_OPTION
        <tag>
            DOC_UPLOAD_SAVE_OPTION
            <value>N</value>
        </tag>
    </section>

<section>
        DOC_UPLOAD_FILTER
        <tag>
            JWT_VALID_TOKEN_COUNT
            <value>5</value>
        </tag>
        <tag>
            JWT_REQUEST_TOKEN
            <value>X-ACCESS-TOKEN</value>
        </tag>
    </section>
    <section>
        DOC_UPLOAD_CASE_STATUS
        <tag>
            OPEN_STATUS
            <value>OP</value>
        </tag>
        <tag>
            SUBMIT_STATUS
            <value>SB</value>
        </tag>
    </section>
    <section>
        DOC_UPLOAD_OPERATION_TYPE
        <tag>
            PREVIEW
            <value>PREVIEW</value>
        </tag>
        <tag>
            DELETE
            <value>DELETE</value>
        </tag>
        <tag>
            SUBMIT
            <value>SUBMIT</value>
        </tag>
        <tag>
            UPLOAD
            <value>UPLOAD</value>
        </tag>
    </section>
    <section>
        DOC_UPLOAD_SCAN_STATUS
        <tag>
            403
            <value>SF</value>
        </tag>
        <tag>
            413
            <value>LF</value>
        </tag>
        <tag>
            415
            <value>WT</value>
        </tag>
        <tag>
            405
            <value>AS</value>
        </tag>
        <tag>
            500
            <value>SE</value>
        </tag>
    </section>
     <section>
        DOC_UPLOAD_PROCESS_CODE
        <tag>
            AOOIDV-ON-LTB
            <value>AOOIDV-ON-LTB</value>
        </tag>
        <tag>
            Mortgage_Roll_Number
            <value>Mortgage_Roll_Number</value>
        </tag>
    </section>
</root>
